[
  {
    "playerId": "207989",
    "date": "2025-12-22",
    "rank": 1,
    "points": 12050,
    "source": "balldontlie"
  },
  {
    "playerId": "206173",
    "date": "2025-12-22",
    "rank": 2,
    "points": 11500,
    "source": "balldontlie"
  },
  {
    "playerId": "100644",
    "date": "2025-12-22",
    "rank": 3,
    "points": 5160,
    "source": "balldontlie"
  },
  {
    "playerId": "104925",
    "date": "2025-12-22",
    "rank": 4,
    "points": 4830,
    "source": "balldontlie"
  },
  {
    "playerId": "134770",
    "date": "2025-12-22",
    "rank": 12,
    "points": 2835,
    "source": "balldontlie"
  },
  {
    "playerId": "106421",
    "date": "2025-12-22",
    "rank": 13,
    "points": 2760,
    "source": "balldontlie"
  },
  {
    "playerId": "208029",
    "date": "2025-12-22",
    "rank": 15,
    "points": 2590,
    "source": "balldontlie"
  },
  {
    "playerId": "126774",
    "date": "2025-12-22",
    "rank": 34,
    "points": 1425,
    "source": "balldontlie"
  },
  {
    "playerId": "105453",
    "date": "2025-12-22",
    "rank": 156,
    "points": 397,
    "source": "balldontlie"
  },
  {
    "playerId": "104527",
    "date": "2025-12-22",
    "rank": 157,
    "points": 397,
    "source": "balldontlie"
  }
]
